"????? ??????, ???????? ?????? ????? ??? ??? EMI ????? ??.20000.00 ?? ?????-????? ?????? ????? ??? ??? ????????? ?????. https://idfcfs.in/DC6jsz ?? ????? ????. TCA",,,
"Dear Customer, Get a High credit limit of 100% of your FD value with FIRST WOW! Credit Card. Apply now https://idfcfs.in/DDV64- TCA. Team IDFC FIRST Bank",Promotional,,
"Dear Customer, Your loved ones deserve the best! Refer IDFC FIRST Bank Savings A/c & earn cashback up to Rs. 1,250 https://idfcfs.in/DDHYWT. T&C apply",Promotional,,
"Dear Customer, avail a personal loan from IDFC FIRST Bank of Rs.100000 right from the comfort of your home! Hurry & avail now https://idfcfs.in/DCTf6t TCA",Promotional,,
"Hi! Earn up to Rs 7,500 cashback by referring your loved ones to open & use NRI Savings Account. Refer now https://idfcfs.in/DCeJSF .Team IDFC FIRST Bank. TCA.",Promotional,,
Airtel company recharege  offer,Promotional,,
"cutt.ly/0wo1N7op. Congratulations, Your Loan amount of rupees 20000. has been disbursed to your bank account. credigen",Promotional,,
"??????? ??????- ??? ??????? ???????? 
https://pledge.mygov.in/swachh-diwali-shubh-diwali/ ?? ?????? ??? ???? ??? ???? ?????????? ?????.
?????? ?????????? ?????? (?????) ?.?",Promotional,,
Political messages,Promotional,,
dnd active but still getting promo calls,Promotional,,
"Today is very Auspicious DIWALI & Amavasya.

Charitable acts done today will benefit most.

Support ISKCON'S ANNADAN & GAUSEVA at
www.iskconmeal.in
ISKCON",Promotional,,
They keep messaging everyday for renewal of insurance which I don’t need anymore,Promotional,,
IAPP-YOUR TRANSACTION OF AMOUNT 3000 0 AGAINST AEPS CASH WITHDRAWAL DATED 12 11 2023 AT 18 14 33 IS SUCCESSFUL WITH TXN ID RRN 331618910455,Service,,
Receiving data pack info every 1 min,Promotional,,
1 missed call(s) received on 11-11-2023 while you were unreachable. Get details of your missed calls ONLY on Airtel Thanks App i.airtel.in/alert,Service,,
Airtel msg for taking data pack,Promotional,,
Harrasment,Promotional,,
Bank promo calls and sms,Promotional,,
"Hi, we have processed Rs. 1215.4 for your Airtel Mobile 9928574507. The payment will be updated within 5 minutes. Please keep your order ID 7129002114073796608 for future reference. Track your payment status via  https://i.airtel.in/Recharge-Bills",Service,,
"World Diabetes Day!
Get FREE Diabetes Screening 14-16 Nov at select Apollo Pharmacy near you.
Test & Beat Diabetes.
Register Now: http://klr.pw/kQRSLd
TCA",Promotional,,
"Dear User
1 step towards self-care. Book a health check & get FREE home sample collection. Code: FREESAMPLE. Tap https://hrqs.in/S8kSUD Apollo 24|7",Promotional,,
Too many data alerts from Airtel,Promotional,,
Received a lot of flash messages from airtel like 50 -60 together,Promotional,,
"Dear Member, Adidas Festive Deal - Exclusive only for web: Get 50% off + Additional 20% on Rs. 4299 valid till 13 Nov. Shop - bit.ly/AdiFest50p3 .TC!",Promotional,,
IAPP-YOUR TRANSACTION OF AMOUNT 505 0 AGAINST AEPS CASH WITHDRAWAL DATED 13 11 2023 AT 10 49 30 IS SUCCESSFUL WITH TXN ID RRN 331710286896,Service,,
"Hi, Your birthday is coming soon. It is time to buy a 1Cr Term Plan for Rs.4391 rather paying Rs.4561 after bday. Click https://qxit.in/2n956M  Paisabazaar",Promotional,,
"Hi 
Iss Diwali banayein apni Skin festive-ready with Lotus Herbals chemical-free products. Wish you & your family Happy Diwali.
CLICK: bit.ly/3sxB6PK",Promotional,,
IAPP-YOUR PROFILE IS ELIGIBLE WITH KREDITBEE  GET INSTANT DISBURSAL UPTO RS 4 LACS  SUBMIT YOUR KYC NOW HTTPS   BIT LY 3FBQW54 LINKBELL,,,
Received message stating credit card point redemption was successful and with a hyperlink.  But I am not a HDFC credit card customer.,Promotional,,
"Dear HDFC  CREDIT CARD REWARDS, Your Registration with BIDS is successful and your UHID is REEDEM https://rb.gy/n99f0 . Thank You, BIDS",Promotional,,
IAPP-DEAR HDFC  CREDIT CARD REWARDS  YOUR REGISTRATION WITH BIDS IS SUCCESSFUL AND YOUR UHID IS REEDEM HTTPS   RB GY N99F0   THANK YOU  BIDS,Promotional,,
"Promotional message to buy their broadband service. Following is the exact content of the message:


“ You're missing out on the most binge worthy shows like Starstruck - Season 3 & Manhattan- S1 & S2 (Library)! Get Airtel Xstream Play & enjoy access to 15+ OTTs, including Sony LIV, Eros Now, LionsgatePlay, hoichoi, Chaupal and more. Watch movies, web series & more, all in one app. Download Now open.airtelxstream.in/XPPSSia”",Promotional,,
एक और प्रीपेड SIM चाहिए? अनलिमिटेड 5G डाटा और कम्प्लीमेंटरी 17+ OTTs का सब्सक्रिप्शन 1 महीने तक अपनी नयी SIM एक्टिवेशन के साथ ना खोएं! पाएं घर बैठे डिलीवरी बिना किसी अतिरिक्त शुल्क के| क्लिक i.airtel.in/prepaid50,Promotional,,
"Your profile is eligible with Kreditbee, get instant disbursal upto Rs 4 Lacs. Submit your KYC now https://bit.ly/3FbQW54 Linkbell",Promotional,,
"Dear HDFC  CREDIT CARD REWARDS, Your Registration with BIDS is successful and your UHID is REEDEM https://rb.gy/n99f0 . Thank You, BIDS",Service,,
cx getting sms frequently from different different portal like rummy circle,Promotional,,
Promotion for recharge,Promotional,,
IAPP-DEAR SIR MADAM GREETINGS FROM DEEPA S READING ROOM YOU ENQUIRED FOR CABIN SPACE   OUR VIVEKANANDA NAGAR BRANCH  WE HAVE VACANCIES IN AC,Promotional,,
Received somebody else's transaction alerts of airtel payments bank. There is a link in the SMS and once clicked i am able to view the transaction details such as debit amount of some other person. I dont know why i am receiving this SMS since i have not registered with Airtel Payments bank.,,,
APP-DEAR HDFC  CREDIT CARD REWARDS  YOUR REGISTRATION WITH BIDS IS SUCCESSFUL AND YOUR UHID IS REEDEM HTTPS   RB GY N99F0   THANK YOU  BIDS,Service,,
APP-DEAR HDFC  CREDIT CARD REWARDS  YOUR REGISTRATION WITH BIDS IS SUCCESSFUL AND YOUR UHID IS REEDEM HTTPS   RB GY N99F0   THANK YOU  BIDS,Service,,
Recharge expired notifications,Promotional,,
Promotional,Promotional,,
Fucking recharge notification messages after receiving a every incoming call. I know my incoming service will be going to blocked on 18th nov if I not recharge. God sake no need to spam me.,Promotional,,
IAPP-DEAR TRAVELER PNR 301563034  BUS  GJ 01 FT 4671 FOR MUMBAI NATHDWARA WILL REACH AT WESTERN HOTEL KASHIMIRA 022 28 SOON  GET THE LATEST,Service,,
IAPP-BILL PYMT OF RS 2950 0 FOR BIL ANNA00000NATUO AUT 16837048 TXN PU0133171J8HLQV44559 ON 131123 VIA AGENT OUTLET  RCPT NBTBPAY PAGE LINK,Service,,
IAPP-YOUR SMARTCOIN VERIFICATION CODE IS 59375  92BDOP44NJ,Service,,
IAPP-THANKS FOR SHOPPING AT VISHAL MEGA MART  CHECK YOUR BILL   LOYALTY POINTS ON OUR APP  QR1 BE Y38C  ORDER ONLINE AT VISHALMEGAMART COM,Service,,
IAPP-PAYMENT OF RS  76500 00 TO AIDHI PROJECTS PRIVATE LIMITED IS SUCCESSFUL  PAYMENT ID   TXYYN00000001949  FOR CHARGE SLIP  CLICK HTTPS,Service,,
IAPP-DEAR CUSTOMER  AVOID CASH PICK UP CHARGES OF RS 413  BY PAYING ONLINE  CLICK HTTPS   IDFCFR IN Q1OGID REGARDS  IDFC FIRST BANK,Service,,
IAPP-YOUR AEPS CW TXN FOR A C XXXXXXXX80205 WITH PNB IS SUCCESSFUL AND DEBITED WITH 1000 00 DATED 13 11 2023  RRN 331711034891 BC LOCATION C,Service,,
IAPP-DEAR CUSTOMER  ELECTRICITY BILL FOR CONSUMER NUMBER N3227001412 OF INR 310 0 IS DUE ON 16 11 23  PAY ONLINE USING LINK HTTPS   TINYURL,Service,,
IAPP-YOUR UCO BANK A C XX2025 HAS BEEN CREDITED WITH RS 1 200 00 BY TRANSFER AVL BAL IN YOUR A C IS RS 1 843 36 FOR FEEDBACK  CLICK HTTPS,Service,,
OTP base  sms,Service,,
Your one time password (OTP) is 6144. Please use this OTP to verify your mobile number. Muthoot Finance-India's No.1 Most Trusted Financial Services Brand.,Service,,
IAPP-DEAR USER  2614 IS YOUR OTP TO AUTHENTICATE YOUR LOGIN IN TRADEINDIA COM  WWW TRADEINDIA COM  2614,Service,,
5488 is your (OTP) one time password for phone verification at Mamaearth +/mABRGCRlL,Service,,
SMS regarding make up,Promotional,,
GETTING MAKE UP SMS,Promotional,,
GETTING MAKE UP SMS,Promotional,,
Instant loan,Promotional,,
IAPP-DEAR CUSTOMER  TO AVOID DISCONTINUATION OF FASTAG SERVICES  KINDLY UPDATE YOUR VEHICLE NO  USING THE LINK HTTPS   IDFCFR IN SYHLA5 BY 1,Promotional,,
IAPP- BOOKING PNR 301563034 345 BUS INFO   BUS NO RJ27PB 0766  BUS SUFFIX    PICKUPMAN NO   DRIVER NO  9829929259  DRIVER2 NO       MANTIS,Service,,
5G data claim in my area,Promotional,,
Pack validity message,Promotional,,
IAPP-HI KAMAL DINESH AHIR   PRESENTING AIRTEL THANKS APP   YOUR ONE STOP DESINATION  FROM CHANGING YOUR WI FI PASSWORD TO UPDATING YOUR REGI,Promotional,,
IAPP-YOUR TRANSACTION OF AMOUNT 3000 0 AGAINST AEPS CASH WITHDRAWAL DATED 14 11 2023 AT 11 06 48 IS SUCCESSFUL WITH TXN ID RRN 331811621268,Service,,
"BhaiDuj Deals@Vishal MegaMart

Buy1Get1 FREE+ExtraDISCOUNT:
Haldiram,Bikano-Sweets
Britannia,Parle-Cookies
Chocopie

Ladies Kurta Buy1Get1
Frocks699  175OFF on2",Promotional,,
Pesh hai Airtel Xsafe! Wi-Fi adharit suraksha camera ke saath ek smart ghar nigraani samadhaan. Abhi order karein aur payein muft visheshagya consultation aur installation. i.airtel.in/SafePre1,Promotional,,
Refund amount will only be transferred to IRCTC Authorized Agent account once Customer share the refund Code received from IRCTC with the Agent-IRCTC,Service,,
Received bank promotional call,Promotional,,
DEAR CUSTOMER  IT S TIME TO SAVE  PAY LOW EMI S WITH A PRE-APPROVED PERSONAL LOAN OF RS  299000 FROM IDFC FIRST BANK  AVAIL NOW HTTPS   IDFCFS,Promotional,,
Received personal loan related message,Promotional,,
call/SMS received  HO RHY  HAI,Promotional,,
"???????,
????? ? ?????? ????????
??????? ??????????? ??????? ????????..!!

?????????-
????.???? ???,
?????, ??????????�??????????",Promotional,,
IAPP-IRCTC APP UPI HAS REQUESTED MONEY ON PAYTM  ON APPROVING  RS 506 8 WILL BE DEBITED FROM YOUR ACCOUNT  HTTP   M P Y TM UPIPAS  PPBL,Service,,
Receiving OTP spam from FamPay,Promotional,,
"World Cup Mania utsav manayein dhamakedaar andaaz mein Wynk Music ke saath! 3 bhagyashaali vijeta payenge Rs. 10,000 tak ke speaker! Khelne ke liye tap karein open.wynk.in/wcm7",Promotional,,
You have successfully got 20000INR ! Please get it as soon as possible !https://tinyurl.com/mrx4nfxm -FOCUSED CASH,Promotional,,
Kreditcow Congratulations! Your application in Kreditcow has been approved. Pls login https://tinyurl.com/mrx4nfxm to use! -FOCUSED CASH,Promotional,,
"Dear 14-11-2023 Customer, your promised repay time is coming soon, please repay 7783.00 by our App in time. REALONETECSTATION",Service,,
"cutt.ly/Pww1Junn. Congratulations, Your Loan amount of rupees 30000. has been disbursed to your bank account. credigen",Service,,
"cutt.ly/0wo1N7op. Congratulations, Your Loan amount of rupees 20000. has been disbursed to your bank account. credigen",Service,,
"cutt.ly/0wo1N7op. Congratulations, Your Loan amount of rupees 20000. has been disbursed to your bank account. credigen",Service,,
"Dear user, based on your good credit record, your credit limit has been increased to Rs 50000. Apply now! cutt.ly/twQBClrA GSOU",Service,,
"cutt.ly/0wo1N7op. Congratulations, Your Loan amount of rupees 20000. has been disbursed to your bank account. credigen",Service,,
You have successfully got 20000INR ! Please get it as soon as possible !https://tinyurl.com/mrx4nfxm -FOCUSED CASH,Promotional,,
"Dear Customer, 17800 has been approved,Register Now! App download link https://bit.ly/48gSAj7 -FOCUSED CASH",Promotional,,
Kreditcow Congratulations! Your application in Kreditcow has been approved. Pls login https://tinyurl.com/mrx4nfxm to use! -FOCUSED CASH,Promotional,,
"Dear user, based on your good credit record, your credit limit has been increased to Rs 50000. Apply now! cutt.ly/twQBClrA GSOU",,,
"cutt.ly/0wo1N7op. Congratulations, Your Loan amount of rupees 20000. has been disbursed to your bank account. credigen",,,
IAPP-GREETINGS IPHONE USER  YOU ARE ELIGIBLE TO TAKE A SHORT SURVEY AND CLAIM RS 50 CASH  CLICK ON HTTPS   BIT LY 3FT22MY CQO3S6 UNOMER,,,
"Dear HDFC  CREDIT CARD REWARDS, Your Registration with BIDS is successful and your UHID is REEDEM https://rb.gy/n99f0 . Thank You, BIDS",,,
currentbills,,,
"Dear sir, Your Meeting time can arranged forDat!ng, Call for more information   8392058894 SUHANI  SAUMYI",,,
"Hi, Fill in Employment Details and Verify your Income for a Higher Credit Limit up to Rs.4 Lakhs. Repay your Loan in up to 24 months. T&C. kredt.be/3u9CoOh",,,
"????????????? ?????? ??? ????? ??????????? ???????? ??????? ?????? ?????!
?????? ?????????? ?????? (?????) ?.?",,,
promotional content in the message,,,
"CONGRATS! You are eligible for a Rs 5 lacs loan. Get in just 48 hrs. Low Interest Rate, No physical docs! CLICK https://bit.ly/3N4X7dm - Upwards.",,,
"CONGRATS! You are eligible for a Rs 5 lacs loan. Get in just 48 hrs. Low Interest Rate, No physical docs! CLICK http://bit.ly/3Wt0nU8 - Upwards.",,,
Get Airtel Xstream fiber,,,
Just 10 min. to get funds in your account & 100%  OFF on PROCESSING FEE from KreditBee with code NVR100. Apply Now! www.gs.im/e/KMUOm1wDeuF -IndiaLends,,,
"Your profile is eligible with Kreditbee, get instant disbursal upto Rs 4 Lacs. Submit your KYC now https://bit.ly/3FbQW54 Linkbell",,,
"Dear customer, get a personal loan from moneyview of up to Rs. 10,00,000* (10 Lac) credited instantly. Apply Now: http://1kx.in/AHgtRf",,,
"आपको दीपावली की शुभकामनाएं

नरेंद्र शिवाजी पटेल
BJP प्रत्याशी उदयपुरा",,,
IAPP-DEAR HDFC CREDIT CARD REWARDS  YOUR PAYMENT IS RECEIVED  AMOUNT INR RS5999 ON CLICK HERE HTTPS   RB GY N99F0   TXN REF WON   THANKS  IN,,,
IAPP-                                   4668489000        11146 63                   17 11 23    HTTPS   1KX IN ATVSQW                                               UPPCL,,,
"????? ????????,
??????? ?????? ??? 8739794000 ?? ??? 31777.22 ????? ?? ?
?????? 18-11-23 ?? https://1kx.in/uPf4EQ ?? ?????? ?? ???? ?? ?????? ??? ???? ?????? - UPPCL",,,
IAPP-DEAR HDFC CREDIT CARD REWARDS  YOUR PAYMENT IS RECEIVED  AMOUNT INR RS5999 ON CLICK HERE HTTPS   RB GY N99F0   TXN REF WON   THANKS  IN,,,
"Hi, your order has been placed. Sounds Good?
Track your order with The Moms Co. 
Travel Skin Essentials worth Rs.1171 Only at Rs.49.
PAY & Shop weurl.co/pywtl7",,,
"Hi, your order has been placed. Sounds Good?
Track your order with The Moms Co. 
Natural Glow Essentials worth Rs.997 Only at Re.1.
PAY & Shop weurl.co/oyMgR0",,,
"9662XXX796 par pack samapt hone wala hai!
Abhi Recharge karein aur anand lein, 1.5GB/din, 100 SMS/din, UL call, 84 din tak, Rs666 mein. Get exclusive benefits on Thanks App. i.airtel.in/AirRech",,,
"CONGRATS! You are eligible for a Rs 5 lacs loan. Get in just 48 hrs. Low Interest Rate, No physical docs! CLICK http://bit.ly/3Wt0nU8 - Upwards.",,,
"Hello Teen Patti Stars users, Your gaming Wallet balance is Rs. 300 Free trial /- To add money to your wallet visit: https://teenpattigold.xyz/ Thx.",,,
offer se realated,,,
Getting multiple messages for loan,,,
"Dear HDFC  CREDIT CARD REWARDS, Your Registration with BIDS is successful and your UHID is REEDEM https://rb.gy/n99f0 . Thank You, BIDS",,,
"??? ???? ??? ??? ????????????? ??? ?? ??, ?????? ?????? ??? ???? ?????? ?? ?? ??? ?? ???? ???? ??, ?? ?????? ???? ??????? DoT ???-???? ???? 1800110420/1963 ?? ????",,,
Thank you for reaching out to us. Looks like you have not opted-in for WhatsApp services. Team- Care Health Insurance,,,
getting promotional calls and sms,,,
Your loan from FastLoan is https://bit.ly/494tapw days overdue. Please pay in time otherwise overdue fees will be charged. GSOU.,,,
"previously also cx has complaint regarding this thig still getting blank sms from this id 
plz resolve asap on priority",,,
"Hey player, Playship Rummy is ISO certified. Your winnings is 100% safe & secure with us, Play now - ct1.io/2gXPybL",,,
"Dear customer, get a personal loan from moneyview of up to Rs.10,00,000* credited instantly. Apply Now: http://1kx.in/JAhDyR",,,
"Hi, Fill in Employment Details and Verify your Income for a Higher Credit Limit up to Rs.4 Lakhs. Repay your Loan in up to 24 months. T&C. kredt.be/3u9CoOh",,,
airtel se  offer related call aa rahe hai,,,
Please use otp: 265714 to validate.,,,
50%-Alerts-: for your daily highspeed data limit. Get 2GB at Rs29 till Midnight. Recharge now https://i.airtel.in/29-Pack,,,
"Dear customer,
Get loan approved from Fibe up to Rs.5,00,000 in 5min.
LOW interest rates
ZERO forclosure charges
Click to avail Now - http://1kx.in/ApHwpt",,,
"Catch Home Minister Amit Shah's exclusive chat on the crucial assembly elections that will set the stage for 2024 LS Polls, in today's TOI newspaper.",,,
Hello User AXIS Bank- Your AXIS bank Card Can be Pre-qualified with a limit of upto Rs.350000 Confirm your details Now : l01.in/gklhl2!990p3m8 Hexa,,,
Please use otp: 740224 to validate.,,,
392468 is OTP for verifying your mobile number with WINDS. This OTP is valid for 60 mins. Do not share this OTP.,,,
Your DTDC OTP is 538244. Happy Shipping!,,,
Your DTDC OTP is 051852. Happy Shipping!,,,
Your DTDC OTP is 739045. Happy Shipping!,,,
483972 is OTP for verifying your mobile number with WINDS. This OTP is valid for 60 mins. Do not share this OTP.,,,
Your DTDC OTP is 350919. Happy Shipping!,,,
Your DTDC OTP is 175559. Happy Shipping!,,,
Your DTDC OTP is 856721. Happy Shipping!,,,
Your DTDC OTP is 893911. Happy Shipping!,,,
Your DTDC OTP is 790706. Happy Shipping!,,,
Your registration for BHIM app has started. If it is not you please report now to your bank. Do not share the card details/OTP to avoid any financial loss NPCI,,,
AKHRI DIN HAI AAJ HERO KE TWO WHEELERS PAR TYOHARON KE OFFERS KA LABH UTHAYE CALL KAREIN :: 9289922383 AJ HI HERO KE SHOWROOM PAR JAYEIN,,,
promotional call and sms from bank,,,
Your loan from Quick is https://bit.ly/47sjuUV days overdue. Please pay in time otherwise overdue fees will be charged. GSOU.,,,
Your loan from CashBee is https://bit.ly/3OT0lo4 days overdue. Please pay in time otherwise overdue fees will be charged. GSOU.,,,
Business loan up to 2Cr. Overdraft facility. You will receive your money within 48 hours*. Click here https://pbzar.in/2F6f1k Paisabazaar,,,
Thank you for your interest in Bajaj personal loan. Your document is not submitted till now. Click on t.ly/mfyY for immediate document pick up.,,,
Thank you for your interest in Bajaj personal loan. Your document is not submitted till now. Click on t.ly/mfyY for immediate document pick up.,,,
Thank you for your interest in Bajaj personal loan. Your document is not submitted till now. Click on t.ly/mfyY for immediate document pick up.,,,
Hey user SBI Bank- Your Rs.245000/- Limit Credit Card is approved. Please Confirm Your details l01.in/glrl5t!8rj2rhn JADEADVRT,,,
"Attention insured member! It is mandatory to update your KYC details. Click on the link to complete the process: https://m.bjazr.in/kAxjBf . Thank you for your attention to this matter.
Caringly Yours, -BAGIC",,,
customer getting promotional calls 7971582410,,,
"08045883433,8884923273 CX WAS GETTING THE UNWANTED CALLS",,,
IAPP-BILL PAID AGAINST ACCOUNT NUMBER 2395051000  WITH AMOUNT 2571 00  MODE WALLET  RECEIPT NO 81116410  RECEIPT DATE 15 11 2023   UHBVNL,,,
"????????????? ?????? ??? ????? ??????????? ???????? ??????? ?????? ?????!
?????? ?????????? ?????? (?????) ?.?",,,
IAPP-OTP FOR LOGIN ON THE MOMS CO  IS TMCXO199 AND VALID TILL 5 MINUTES  DO NOT SHARE THIS OTP  GRAB OUR BESTSELLING COMBOS WORTH RS 997 ONL,,,
IAPP-REMINDER  RUPEEREDEE HAS REQUESTED PAYMENT OF INR 11000 00  YOU CAN PAY THROUGH THIS LINK  HTTPS   RZP IO I W417ISK7UP   RAZORPAY,,,
IAPP-YOUR A C XX6966 CREDITED FOR RS 1200 AVAILABLE BAL AFTER TXN RS 1773 MSG ID 1185921669 TIME 15 11 2023 16 59 43 KARNATAKA GRAMIN BANK,,,
एक और प्रीपेड SIM चाहिए? अनलिमिटेड 5G डाटा और कम्प्लीमेंटरी 17+ OTTs का सब्सक्रिप्शन 1 महीने तक अपनी नयी SIM एक्टिवेशन के साथ ना खोएं! पाएं घर बैठे डिलीवरी बिना किसी अतिरिक्त शुल्क के| क्लिक i.airtel.in/prepaid50,,,
IAPP-YOUR TRANSACTION OF AMOUNT 500 0 AGAINST AEPS CASH WITHDRAWAL DATED 15 11 2023 AT 18 30 42 IS SUCCESSFUL WITH TXN ID RRN 331918246289,,,
complaint status smss,,,
Airtel Recharge plan marketing.,,,
IAPP-DEAR CUSTOMER  YOUR ACCOUNT IS DUE FOR REKYC  PLEASE UPDATE USING LINK HTTPS   MYPORTAL UNIONBANKOFINDIA CO IN REKYC  OR THROUGH OUR AT,,,
Airtel spam calling to sell it’s services.,,,
THE UNSOLICITED COMMERCIAL COMMUNICATION,,,
Stop sending me fake free data messages.,,,
Getting multiple messages for loan,,,
"Yay, Renox Men's.. has been successfully delivered! Please take a minute to share your delivery experience. Click here https://ltl.sh/Csqo4hpBDg
Meesho",,,
"Yay, Tailors Single.. has been successfully delivered! Please take a minute to share your delivery experience. Click here https://ltl.sh/CsqkEtUrrA
Meesho",,,
SHOPPING OFFER,,,
हम हर दिन बेहतर हो रहे हैं! INDRA NAGAR DEHRADUN में एक नया टावर लगाया गया है। अब आप अपने एयरटेल पर तेज़ डाटा स्पीड और बेहतर नेटवर्क कवरेज का आनंद ले सकते हैं। एयरटेल का बेहतरीन नेटवर्क चुनने के लिए धन्यवाद|,,,
call/SMS received by you,,,
"Hi, We saw you showed interest in a personal loan. To complete your loan process, just select the loan amount, tenure & EMI. Click here i.airtel.in/NPQJI",,,
"Dear Customer,
To ensure the security of your insurance policy, it's mandatory to update your KYC details. Please do so by clicking on this link: https://m.bjazr.in/kAxeBE  . Your prompt action is appreciated!
Caringly Yours, -BAGIC",,,
"FEDERAL BANK brings pre-approved loan of Rs.500000 with min docs, flexible terms and direct bank transfer. Click http://nc7.in/VkPNuMhZ Paisabazaar",,,
"FREE 1GB Data Credited!
Claim your DATA coupon on Airtel Thanks App. i.airtel.in/FreeData1GB",,,
"ccf 9869870611
cx said that he activated the dnd and STILL getting THE PROMOTIONAL CALLS
AND HE RAISED MULTIPLE COMPLAINTS and still facing the same issue
cx activated the dnd on his no again and again and still it is showing inactive
and we tried to activated the DND and it is showing error : We are facing some technical issues. Please try again later.
please look into it",,,
APP-HELLO USER AXIS BANK- YOUR AXIS BANK CARD CAN BE PRE-QUALIFIED WITH A LIMIT OF UPTO RS.350000 CONFIRM YOUR DETAILS NOW : L01.IN/GMD9QP!9,,,
Loan sms and account credit,,,
"Hi Nayan, for up to 5,00,000 spend limit on your 
pre-qualified zero-fee 
YES BANK Credit Card, click here. TnC apply bnkbzr.co/wpxMGx4jbQ",,,
Your DTDC OTP is 545489. Happy Shipping!,,,
"NEWMITRA, Your One Time OTP Is 511137",,,
unwarranted calls,,,
"NEWMITRA, Your One Time OTP Is 564796",,,
Your DTDC OTP is 032564. Happy Shipping!,,,
"NEWMITRA, Your One Time OTP Is 328537",,,
IAPP-EMI NETWORK CARD LIMIT IS RS 194 286  VIEW  HTTP   R BFLCOMM IN GJEG9BQK  NOW  FOR OTHER PRODUCTS  CLICK  HTTP   R BFLCOMM IN Q1OYHYKU,,,
IAPP-EMI NETWORK CARD LIMIT IS RS 200 000  VIEW  HTTP   R BFLCOMM IN TCRMJCEE  NOW  FOR OTHER PRODUCTS  CLICK  HTTP   R BFLCOMM IN P8JOIIME,,,
"HD box ab hua aapka sirf Rs0 mein!
Jo dekhein sirf uska hi bhugtaan karein Airtel Digital TV ke saath!
Aaj hi 8448284750 par miss call dein!",,,
"Your profile is eligible with Kreditbee, get instant disbursal upto Rs 4 Lacs. Submit your KYC now https://bit.ly/3FbQW54 Linkbell",,,
"Your profile is eligible with Kreditbee, get instant disbursal upto Rs 4 Lacs. Submit your KYC now https://bit.ly/3FbQW54 Linkbell",,,
"Hi
Need urgent funds? CASHe can help. Get a loan of up to Rs. 4 Lakhs with easy application and quick disbursal. Apply now www.gs.im/e/DnkA00LXClS -IndiaLends",,,
I have been receiving spam messages or marketing messages from the below details. Please block.,,,
Call from Airtel company for product marketing,,,
"Hi
Need urgent funds? CASHe can help. Get a loan of up to Rs. 4 Lakhs with easy application and quick disbursal. Apply now www.gs.im/e/IU8kDkQD7vt -IndiaLends",,,
CX IS GETTING MULITIPLE SMS FROM THESE ID .CX WANTS THIS ISSUE TO BE RESOLVED ASAP,,,
IAPP-HI PAVAN KUMAR BAYYANA  HAVING MADE A CLAIM  YOU ALREADY KNOW THE IMPORTANCE OF CAR INSURANCE  RENEW YOUR EXPIRING INSURANCE FOR FORD F,,,
"FREE 1GB Data Credited!
Claim your DATA coupon on Airtel Thanks App. i.airtel.in/FreeData1GB",,,
"Hey Sanyum, Need cash fast? Get up to 5 Lakh instant loan via NoBroker INSTACASH. 
APPLY NOW a.nobrkr.com/k7NoKKx",,,
"Your profile is eligible with Kreditbee, get instant disbursal upto Rs 4 Lacs. Submit your KYC now https://bit.ly/3FbQW54 Linkbell",,,
IAPP-746332 IS THE AUTHENTICATION CODE FOR PROVIDING YOUR CONSENT TO RBL BANK CREDIT CARD  PLEASE REFER TO  WWW RBLBANK COM CC TNC FOR DETAI,,,
AD-MUTHUT AD-DLHVRY AD-BAJAJF JX-APOHS,,,
"आप Scam 2003 - The Telgi Story और The Jengaburu Curse जैसे देखें जाने वाले शो मिस कर रहे हैं!
पाएं एयरटेल एक्सस्ट्रीम प्ले और आनंद लें 15+ OTT साथ में Sony LIV, Eros Now, Lionsgate Play, hoichoi, Chaupal और बहुत कुछ। देखें मूवी, वेब सीरीज़ और बहुत कुछ सभी एक ही ऐप में। अभी डाउनलोड करें open.airtelxstream.in/XPPSSia",,,
Getting promotional calls from iartel,,,
