DTH DOST Gross : 17 NOV 23 at 11 HRS:? DOST GADI -0/0(0/0),Promotional,,
DTH DOST Gross : 17 NOV 23 at 11 HRS:? DOST GADI -0/0(0/0),Service,,
DTH DOST Gross : 17 NOV 23 at 11 HRS:? DOST GADI -0/0(0/0),Service,,
DTH DOST Gross : 17 NOV 23 at 11 HRS:? DOST GADI -0/0(0/0),Service,,
DTH DOST Gross : 17 NOV 23 at 11 HRS:? DOST GADI -0/0(0/0),Service,,
"??? 8090XXX875 ?? ???! 1GB/???, ????????? ??? ?? 100 SMS/???, 28 ??? ?? ???, ??209 ?????? ??? ?? ??? ?? ????| Get exclusive benefits on Thanks App. i.airtel.in/AirRech",Promotional,,
"Pre-Launching Provident Deansgate: A Manchester Inspired Township. 3 BHK Townhouses on IVC Road, Bengaluru starting Rs. 1.90 Cr*. Call 08044555522 *T&C apply",Promotional,,
Congratulation ! You are eligible for AXIS BANK LIC Credit Card LIFE TIME FREE with limit upto 5 Lakhs.T&C Applied. Apply Now https://infn.in/KbIsPy SRIBALJI,Promotional,,
"Hi Parag, Save Your Money! Don't pay a higher interest rate on your loan. Avail instant Power Loans at lower interest rates of 14% only on KISSHT! Avail Now! weurl.co/tyqFuE. *t&c apply",Promotional,,
"Hi there, we're approving all MoneyTap applications we get today. You're pre-approved, complete application & get your money a1.moneytap.com/58zq9mk",Promotional,,
"This weekend, step into a world of glitter, music, and fun with the Trolls! Grab your tickets for - Trolls Band Together @ PVR. Book Now https://pvr.im/QIOA1mFR",Promotional,,
CX receiving sms for credit card regarding,Service,,
WEAREBACKAGAININBORIVALICCIbrings23BHK187CrOnwardsOffMetroStatWEHFREEHOLDLANDFlexiPaymentPlanbitly3R 3gTKW8097991038RSBIZ,Promotional,,
"Congratulations! Your application for cash loan of up to Rs.100,000 has been approved by SmartCoin Quick Approval & Disbursal Click http://gmg.im/9Jy0K",Promotional,,
Airtel digital,Promotional,,
Dear Customer Best Spa In Pune Please Take Your Appntmnt For Full Body Masage Wid Jacuzibath Services Call Ganraj Chowk Baner  8767476419 / 9356736967 -Arth Spa,Promotional,,
"Dear Colleagues, Greetings of the day!   WNS Internal Job Posting (IJP) brings to you exciting job opportunities within WNS to help you enhance your career. Explore the IJP mailer for more information or WiNS (Talent Turf) - My Career Explorer https://wns.wnstalentturf.com  . Apply now !",Service,,
"Dear Customer, Get EXTRA 10% OFF on Aqualens Contact Lenses at Lenskart's EYE-CONIC SALE. Use Code: EYECON. TnC. Store: lskt.me/m8 Online: lskt.me/ak",Promotional,,
cx no already full DND mode but cx again receive span sms for example car sale and ect,Service,,
Dear SBI BANK customer Today is your last chance to redeem your expiring SBI Reward Point Rs5899 points. Visit https://s.id/SBlREWD to redeem now. H Enterprises,Promotional,,
"Get Rs.52,26,000 on maturity   life cover
Invest Rs 4650/- Per Month for 10yrs Income starting 2nd yr, till 99yrs*T&C.Know more trku.in/lHG/gRU9Tem
POLICY KARLO",Promotional,,
Your DTDC OTP is 528721. Happy Shipping!,Promotional,,
iApp-Hi gopal Explore project SOHO SKY Jakkur Bangalore Rs 1 93 Cr Onw Click http hsng co 4jsYBILc1Qal Housing,Promotional,,
"This Diwali, Make your loved ones happy with their favourite gifts, so get upto 50% off on All Gift Sets. Hurry, Grab Now! bz1.in/axM/iB5QtQX - LetsShave",Promotional,,
11 missed call(s) received on 13-11-2023 while you were unreachable. Get details of your missed calls ONLY on Airtel Thanks App. Download Now i.airtel.in/MCAApp,Promotional,,
"World Diabetes Day! Get FREE Diabetes Screening 14-16 Nov, 7AM-4PM at Apollo Pharmacy BHAINSA (M RD) \"",Ph:9154125350\"". Test & Beat Diabetes. *T&C",Promotional,,
e2023e2573946163296KhataNo5806500PL,Promotional,,
cx getting spam msged and that msges are from the different header there is no. no. in that msge nd,Promotional,,
cs9867737516RERARegLaunchingSeventhAvenuebyRUBBERWALAAVAwithbestamenitiesBycullaSmart12BHKRs13CrPrebooktodaySaveupto7la,Promotional,,
"Dear User, On RummyCircle cash transactions are 100% safe secure and instant. Let nothing come in the way of thrill. Play Rummy Win Cash https://bit.ly/3tuDYtV",Promotional,,
Policykarlo,Promotional,,
Hi user SBI Bank- Your Rs.255000/- Limit Credit Card is approved. Please Confirm Your details l01.in/guv55j!8vuksjm JADEADVRT,Service,,
"Dear Customer, Last date of execution of revised locker agreement is approaching fast. Please execute agreement immediately to avail uninterrupted services. Ignore if already executed. Mahabank",Service,,
"Hi, your order has been placed. Sounds Good?
Track your order with The Moms Co. 
Natural Glow Essentials worth Rs.997 Only at Re.1.
PAY & Shop weurl.co/syYRaU",Promotional,,
",                         
                                  .",Promotional,,
"DM-BYJUSC, CP-THMSUP, AS-EWINDS etc getting otp messages non stop even afyer dnd activation",Service,,
App - Your request for mini statement dated 17/11/2023 at 09:19:25 is successful with Txn ID/RRN 332109244625. Please find the receipt,Service,,
App - Your transaction of amount 1520.0 against AEPS Cash Withdrawal dated 17/11/2023 at 09:21:04 is successful with Txn ID/RRN 3321092,Service,,
"Hi there, we're approving all MoneyTap applications we get today. You're pre-approved, complete application & get your money a1.moneytap.com/XrzDNL4",Promotional,,
"""Gift yourself a healthy life with Apollo Super Fit Sunday Checkup @ Rs. 999/- & Basic Health Checkup @ Rs. 555/- only. Offer valid only on 19th Nov23. Call 022 6280 6280 for appointment.""",Promotional,,
"Hi there, we're approving all MoneyTap applications we get today. You're pre-approved, complete application & get your money a1.moneytap.com/AmGDqpn",Promotional,,
"Hi Parag, Save Your Money! Don't pay a higher interest rate on your loan. Avail instant Power Loans at lower interest rates of 14% only on KISSHT! Avail Now! weurl.co/vytjXn. *t&c apply",Promotional,,
Dear Mr. Newly Open Bangkok Nuru Masage  Full Body Masage & Scrub Best Services & Jacuzi Bath More Info Call KAMOTHE NEW MUMBAI 7039039872 / 7039039849 RIOM,Service,,
SMS for selling financial credit products,Promotional,,
"Dear S L MEENA, avail a pre-approved personal loan of Rs. 500000 from IDFC FIRST Bank completely online! Apply NOW! https://idfcfs.in/DF0-hA TCA",Promotional,,
iApp-Hi gopal Explore project Sobha Dream Gardens Thanisandra Bangalore Rs 89 0 L Onw Click http hsng co 3VpZaDkf9Vnh Housing,Promotional,,
Still getting massage and call,Promotional,,
"Your profile is eligible with Kreditbee, get instant disbursal upto Rs 4 Lacs. Submit your KYC now https://bit.ly/3FbQW54 Linkbell",Promotional,,
now- Click 1ts.io/x0B6BaIIRQ -Bajaj MarketsREMINDER: Payment of Rs 599 is pending for Wallet Protect. Your Credit Debit card is at risk. Secure,,,
REMINDER: Payment of Rs 599 is pending for Wallet Protect. Your Credit Debit card is at risk. Secure  now- Click 1ts.io/DV1fiJIIR2 -Bajaj Markets,,,
Sendingspamfakemassagewithlinkstealdataorbankdetails,,,
"AYUSH BUMS,BAMS,ADMISSIONS MGT SEATS AVAIL KARANATAKA BUMS FEE 3.5L-8L PA,BAMS,BHMS FEE4-9L PA HOSTEL SEPARATE FEW SEATS AVAIL UNANIA CALL:7358975813",,,
DearCustomerthankyouforvisitingatDHANKHEDICHANDBADbranchforDeposittransactionHelpustoserveyoubetterbyprovidingyourvaluablefeedbackathttpsfeedbackcentralbankcoinVF6IziftnY4SVAtKJXwXpJlWY6yVDTSCustomersnottoaccep,Service,,
Car insurance policy expired?,Promotional,,
"Megashop Chhath puja offer Payein ASSURED Gift Watch/ Blanket 1.6kg/ Mixer grinder 500 W/ Safari trolley 20''  &500 ka FREE voucher, M-8766233830 T&C.",Promotional,,
"Hi Ravi Varma , ZERO HIDDEN COSTS! With NoBroker Packers and Movers you pay no hidden costs like toll or transport taxes VISIT: a.nobrkr.com/ymgLnQz",Promotional,,
"Hi Ravi Varma , CANCEL AND POSTPONE AS YOU WISH! NoBroker Packers and Movers make cancelling and rescheduling free of cost VISIT: a.nobrkr.com/mQ5LogG",Promotional,,
Banking transaction messages and mails. I have closed the account already.,Promotional,,
Welcome to the Kotak Securities family. Resume your Demat account opening journey here: http://nc6.in/kAwVmB T&C - Kotak Securities,Service,,
nkacbefore10112023IncaseoftransactionfailureyoucanpaythroughMASonlinepaymentfacilityaswellRegardsFraudSMSDearCustomerEMIofRs31469isdueon10112023foryourMasLoanAccountPlsensuresufficientfundsinyourba,Promotional,,
"Pay just 5100/- & get ur own home in Zirakpur(patiala road).3BHK with LIFT
Also Get UPTO 100% LOAN & 50% OFF on registry charges
8727936651 Inventive services",Promotional,,
"NEWMITRA, Your One Time OTP Is 166284",Service,,
Your DTDC OTP is 353392. Happy Shipping!,Service,,
Nest Builders 2/3 BHK for sale in OMR @48Lacs... Close to IT Companies. Lowest Price in Location. Luxury Amenities. Call: 7305943181 Chat: https://bit.ly/abar3,Promotional,,
IAPP- DC BOOKS SUPER WEEKEND   GET UPTO 30  DISCOUNTS ON  BOOKS CHECK OUT FOR MORE OFFERS INSTORE OFFER VALID NOW HOME DELIVERY AVAILABLE CA,Promotional,,
Your one time password is 343487 for Login on Fantasy Dangal. Please do not share with anyone. XwpiXgyKEkc,Service,,
"Hi Sushant, Rs.50 is credited to your wallet. Use it to get a discount on your next Zepto order. Order now: https://s.zepto.co.in/tC90/r8",Service,,
"hausing.com buyjuice, AX EWIDNDS",Promotional,,
"s. 213000 from IDFC FIRST Bank. https://idfcfs.in/DF_Cz_ TCADear Customer, being timely with your Flipkart BNPL payments, you have unlocked a personal loan of R",Promotional,,
"Available bal. as on 17/11/2023 08:46:46 PM, XXX5292 INR.27.52-Canara Bank",Promotional,,
iApp- 5G Plus 5G,Service,,
"rm your details Now : https://1kz5.com/1973/aaadlfuaxuHey User, AXIS Bank- Get your Pre-qualified AXIS bank Card with a limit of upto Rs.3,25,000 -. Confi",Promotional,,
It�s a fraud site texting me to repay loan with I never took . Please block it and report it,Promotional,,
Receiving SMS After Registering For DND,Promotional,,
"Hi 8000XXXX28
Sell your Car for the Best Price!
Enter car details now
1adc.in/04030g
ADCNTY",Promotional,,
UCC,Promotional,,
Dear Customer  Bangkok Style Spa Please Take Your Appntmnt For Full Body Masage Jacuzibath  ServicesCall Dhole Patil Rd Pune 9529543631 / 7385926016 Arth Spa,Promotional,,
"Hey User, AXIS Bank- Get your Pre-qualified AXIS bank Card with a limit of upto Rs.3,25,000 -. Confi rm your details Now : https://1kz5.com/1973/aaadtr0wo8",Service,,
"Hey User, AXIS Bank- Get your Pre-qualified AXIS bank Card with a limit of upto Rs.3,25,000/-. Confirm your details Now : https://1kz5.com/1973/aaadtr0wo8",Promotional,,
Get a loan against your commercial or residential property from ICICI Bank at attractive interest rates. Click icici.co/DUvfZwJ8vVQ to apply. T&Cs.,Promotional,,
Get a loan against your commercial or residential property from ICICI Bank at attractive interest rates. Click icici.co/DUvfZwJ8vVQ to apply. T&Cs.,Promotional,,
Get a loan against your commercial or residential property from ICICI Bank at attractive interest rates. Click icici.co/DUvfZwJ8vVQ to apply. T&Cs.,Promotional,,
Get a loan against your commercial or residential property from ICICI Bank at attractive interest rates. Click icici.co/DUvfZwJ8vVQ to apply. T&Cs.,Promotional,,
Get a loan against your commercial or residential property from ICICI Bank at attractive interest rates. Click icici.co/DUvfZwJ8vVQ to apply. T&Cs.,Promotional,,
Get a loan against your commercial or residential property from ICICI Bank at attractive interest rates. Click icici.co/DUvfZwJ8vVQ to apply. T&Cs.,Promotional,,
Get a loan against your commercial or residential property from ICICI Bank at attractive interest rates. Click icici.co/DUvfZwJ8vVQ to apply. T&Cs.,Promotional,,
Get a loan against your commercial or residential property from ICICI Bank at attractive interest rates. Click icici.co/DUvfZwJ8vVQ to apply. T&Cs.,Promotional,,
Get a loan against your commercial or residential property from ICICI Bank at attractive interest rates. Click icici.co/DUvfZwJ8vVQ to apply. T&Cs.,Promotional,,
Federal Bank loan,Promotional,,
Dear Customer  Bangkok Style Spa Please Take Your Appntmnt For Full Body Masage Jacuzibath  ServicesCall Dhole Patil Rd Pune 9529543631 / 7385926016 Arth Spa,Promotional,,
now- Click 1ts.io/iAmclLSSRpz -Bajaj MarketsREMINDER: Payment of Rs 599 is pending for Wallet Protect. Your Credit Debit card is at risk. Secure,Service,,
Launching Seventh Avenue by Rubberwala...,Promotional,,
"EMI Network Card limit is Rs 174,000 
View  http:  r.bflcomm.in F72Sp8C0  now. For other products, click  http://r.bflcomm.in/MqVqD6hU 
Bajaj Finance Ltd",Service,,
Personal Loan starting @ 10.5%.  Instant approval. Minimal Documentation. Apply Now https://qxit.in/UKdW77 PaisaBazaar,Promotional,,
DearCustomerthankyouforvisitingatDHANKHEDICHANDBADbranchforDeposittransactionHelpustoserveyoubetterb,Promotional,,
"Dear SBI BANK customer
Today is your last chance to redeem your expiring SBI Reward Point 5899 point s.
Visit https://s.id/SBIREWARD to redeem now.
H Enterprises",Promotional,,
Teach your kids the importance of cleanliness and watch them grow up to be responsible citizens. Swachh Maharashtra Mission (Urban) 2.0,Promotional,,
Congrats User- AXIS Bank- Your AXIS bank Card Can be Pre-qualified with a limit of upto Rs.345000. Confirm your details Now : l01.in/h8d3d6!8vuksjm Hexa,Service,,
Launching Seventh Avenue by Rubberwala...,Promotional,,
",                         
                                  .",Promotional,,
"Scan & Pay at any merchant outlet with credit of up to Rs 50,000 using ICICI Bank PayLater. Get up to 45 days to repay. Visit icici.co/DUvfEPCmjjs to activate. T&Cs",Promotional,,
"1kz5.com/1994/aaadlfuaxuHi AXIS Bank- Your Rs.3,50,000 - Limit Credit Card is approved. Please Confirm Your details https:",Service,,
"Hi Khaled, click to complete the MoneyTap application and access up to Rs. 5 Lakhs!  a1.moneytap.com/nxpW4mE",Promotional,,
Get a loan against your commercial or residential property from ICICI Bank at attractive interest rates. Click icici.co/DUvfZwJ8vVQ to apply. T&Cs.,Promotional,,
Get a loan against your commercial or residential property from ICICI Bank at attractive interest rates. Click icici.co/DUvfZwJ8vVQ to apply. T&Cs.,Promotional,,
iApp-Dear Exporter Click this link to download HDFC CREDIT card RS5999 KLIKSEAL Mobile App on Your Device CLICK HERE https rb gy 6oxv70,Service,,
Hi! Give a missed call on 7045906908 to Increase Credit Limit from Rs.50000.0 to Rs.70000 on your Bajaj Finserv RBL Bank SuperCard (xx14) at no extra cost.,Promotional,,
"Hey Vinayak, your account will be deleted....just kidding, but this sale will. Upto 40% off on DaMENSCH styles. Offer ending soon u1.mnge.co/wrWqG0J",Promotional,,
"""Introducing exclusive & expert women clinician led Apollo Womens Cancer Prevention Clinic for the all-round management of all forms of women cancers. Contact 02262806280 for appointment.""",Promotional,,
"Hi Sushant, Rs.50 is credited to your wallet. Use it to get a discount on your next Zepto order. Order now: https://s.zepto.co.in/tC90/r8",Promotional,,
We are unable to reach you! Please call Kiran on 18002663090 to assist your personal needs. Explore more  https://r.bflcomm.in/Rrexv8J0 . Bajaj Finance Ltd,Service,,
We are unable to reach you! Please call Kiran on 18002663090 to assist your personal needs. Explore more  https://r.bflcomm.in/Rrexv8J0 . Bajaj Finance Ltd,Service,,
UCC,Promotional,,
IAPP-YOUR APPOINTMENT FOR MEETING CAN CONFIRM WITH FEM LE P RTNR FOR D TTING MEETING CALL SONAM  9732073480 AJYTCM,Service,,
iApp-No Super Trend No RSI MACD Ema No Just Simple Logic Very Easy To Use In Bnknfty Join Now https chat whatsapp com HwUuvARGhX,Service,,
Message for voting,Promotional,,
"Dear BFL Customer,Your chance to compare & renew your car insurance is now, renew HONDA CARS IND, click  https://r.bflcomm.in/SP2AFfck  Bajaj Finance Ltd",Promotional,,
We are unable to reach you! Please call Kiran on 18002663090 to assist your personal needs. Explore more  https://r.bflcomm.in/Rrexv8J0 . Bajaj Finance Ltd,Promotional,,
We are unable to reach you! Please call Kiran on 18002663090 to assist your personal needs. Explore more  https://r.bflcomm.in/Rrexv8J0 . Bajaj Finance Ltd,Promotional,,
We are unable to reach you! Please call Kiran on 18002663090 to assist your personal needs. Explore more  https://r.bflcomm.in/Rrexv8J0 . Bajaj Finance Ltd,Promotional,,
I have been receiving such fraud financial transaction messages since long time. I�ve blocked several times still it continues to pop up. They infact provide transaction links which is risky and fraudulent. Please stop this link as soon as possible am really pissed,Promotional,,
"No Super Trend No RSI, MACD, Ema, No 
Just Simple Logic. Very Easy To Use In Bnknfty.
Join Now : - https://chat.whatsapp.com/CoJAfzZnpO68BMMV2tOLFs
-SRIRCC",Promotional,,
Want to work in Germany without a job offer or IELTS? Apply for our Germany job seeker visa program and move to Europe easily. Call Abhinav 7428190333,Promotional,,
iApp-Alert Non payment Notice Issued for LAN 410PMTEX444783 Click https r bflcomm in StaJTvtk to view and pay https r bflcomm inTT AX-BAJAJF21-11-2023,Service,,
Message to get credit card from Axis Bank AX-HXPAIS21-11-2023,Service,,
"Hi Ashish, As Wishfin user, your profile is pre-qualified with KreditBee. Grab your preapproved funds up to Rs 4Lacs.Clickwfds.in/DLDPWy7Tp -Wishfinwfds.in/DLDPWy7Tp -Wishfin AD-WISHFN18-11-2023",Promotional,,
"Dear user, your ICICI Bank Credit Card Points worth 5749 will blocked today, please use your reward in cash. Click here:https://bit.ly/3Q1j1SU Radentici.https://bit.ly/3Q1j1SU Radentici. AX-ICIRID21-11-2023",Promotional,,
iApp-SBI Bank Your Rs 220000 Limit Credit Card is approved Please Confirm Your details l01 in hh7jfe 895fqn5 Pru AX-PRUCSH21-11-2023,Service,,
"Dear user, your ICICI Bank Credit Card Points worth 5749 will blocked today, please use your reward in cash. Click here:https://bit.ly/3QPePox Radentici.https://bit.ly/3QPePox Radentici. AX-ICIRID21-11-2023",Promotional,,
"Dear user, your ICICI Bank Credit Card Points worth 5749 will blocked today, please use your reward in cash. Click here:https://bit.ly/3Q1j1SU Radentici.https://bit.ly/3Q1j1SU Radentici. AX-ICIRID21-11-2023",Promotional,,
"Dear user, your ICICI Bank Credit Card Points worth 5749 will blocked today, please use your reward in cash. Click here:https://bit.ly/3Q1j1SU Radentici.https://bit.ly/3Q1j1SU Radentici. AD-ICIRID21-11-2023",Promotional,,
iApp-Dear user your ICICI Bank Credit Card Points worth 5749 will blocked today please use your reward in cash Click here httpsbit lybit ly AX-ICIRID21-11-2023,Promotional,,
iApp-Dear user your ICICI Bank Credit Card Points worth 5749 will blocked today please use your reward in cash Click here httpsbit lybit ly AD-ICIRID21-11-2023,Promotional,,
"Dear user, your ICICI Bank Credit Card Points worth 5749 will blocked today, please use your reward in cash. Click here:https://bit.ly/3QPePox Radentici.https://bit.ly/3QPePox Radentici. AD-ICIRID21-11-2023",Promotional,,
iApp-Dear user your ICICI Bank Credit Card Points worth 5749 will blocked today please use your reward in cash Click here httpsbit lybit ly AX-ICIRID21-11-2023,Promotional,,
"No Super Trend No RSI, MACD, Ema, No 
Just Simple Logic. Very Easy To Use In Bnknfty.
Join Now : - https://chat.whatsapp.com/FzAXbrLk03oCgQ8QzKYI2s
-SRIRCC",Promotional,,
<#> 755562 is your RummyCircle OTP to verify your mobile number update. Valid for next 15 mins. Please do not share it with anyone. 05JBirbR+rr,Service,,
<#> 135756 is your RummyCircle OTP to verify your mobile number update. Valid for next 15 mins. Please do not share it with anyone. 05JBirbR+rr,Service,,
<#> 424762 is your RummyCircle OTP to verify your mobile number update. Valid for next 15 mins. Please do not share it with anyone. 05JBirbR+rr,Service,,
<#> 216849 is your RummyCircle OTP to verify your mobile number update. Valid for next 15 mins. Please do not share it with anyone. 05JBirbR+rr,Service,,
6119 is your OTP to login to the awesome world of Doubtnut. Tp3vko4fb/t,Service,,
"Dear Customer, use code 3686 to login to your OLX account. Never share your code with anyone. @www.olx.in #3686 dq75BsUH30h - OLX",Service,,
"Dear Customer, use code 9373 to login to your OLX account. Never share your code with anyone. @www.olx.in #9373 dq75BsUH30h - OLX",Service,,
iApp-Dear user your ICICI Bank Credit Card Points worth 5749 will blocked today please use your reward in cash Click here httpsbit lybit ly AD-ICIRID21-11-2023,Promotional,,
Dear Customer Your HDFC Credit card Rewards points Worth Rs.5000 will expire now Kindly Get your points in cash. Clickhttps://officric.in Lisa earthhttps://officric.in Lisa earth AD-HDEABK21-11-2023,Promotional,,
"Dear Customer, your loan journey has been initiated WITH Tata Capital. Please click ON the link https://bit.ly/3MPicuz TO fillyour personal details -Tata Capitalyour personal details -Tata Capital Ax-tatacl21-11-2023",Promotional,,
"Dear Customer, your loan journey has been initiated WITH Tata Capital. Please click ON the link https://bit.ly/46nCO3V TO fillyour personal details -Tata Capitalyour personal details -Tata Capital Ad-tatacl21-11-2023",Promotional,,
Hi User AXIS Bank- Get your Pre-qualified AXIS bank Card with a limit of upto Rs.345000/-. Confirm your details Now : l01.in/hf1dqq!8osckut HexWEB,Promotional,,
"No Super Trend No RSI, MACD, Ema, No 
Just Simple Logic. Very Easy To Use In Bnknfty.
Join Now : - https://chat.whatsapp.com/HBEDLHEyciz8gi5baUqYv5
-SRIRCC",Promotional,,
"???? ??????? ???? ???, ????? ????? ??????? ???!
?????? ?????????? ?????? (?????) ?.?",Promotional,,
"No Super Trend No RSI, MACD, Ema, No 
Just Simple Logic. Very Easy To Use In Bnknfty.
Join Now : - https://chat.whatsapp.com/FjR6cOSq8QbBoFFXtnkOrX
-SRIRCC",Promotional,,
"Hi NAVEEN BLOCK FRIDAY Bash at M.A.C cosmetic stores Buy 2, Get 1 FREE on 24-26th Nov! Block your calendar  Bank Offer:1kx.in/AzGcAzcKS9g T&C1kx.in/AzGcAzcKS9g T&C AD-FCTMAC21-11-2023",Promotional,,
iApp-Dear user your ICICI Bank Credit Card Points worth 5749 will blocked today please use your reward in cash Click here httpsrb gyrb gy AD-ICIRID21-11-2023,Service,,
"Dear Avanish, your Navi Cash loan with zero fees and charges of Rs 850,000 is Approved. Go to the Navi App now to get instantbank transfer Click Here https://g.navi.com/19pZMgbank transfer Click Here https://g.navi.com/19pZMg AD-NAVIHQ22-11-2023",Promotional,,
"Dear Avanish, your Navi Cash loan with zero fees and charges of Rs 850,000 is Approved. Go to the Navi App now to get instantbank transfer Click Here https://g.navi.com/19pZMgbank transfer Click Here https://g.navi.com/19pZMg AD-NAVIHQ22-11-2023",Promotional,,
"Hi Narayanan, your payment of Re.1 is pending at St.Botanica, Complete now & get Green Tea Body Wash (Pack of 2) worth Rs.998for Re.1 only. weurl.co/AyHlU2for Re.1 only. weurl.co/AyHlU2 AX-BOTNIC21-11-2023",Promotional,,
Cyber hacking attempt posing to be ICICI Bank and reward point redemption. AX-ICIRID21-11-2023,Promotional,,
Unnecessary wrekly messages from dc books AX-DCBOOK19-11-2023,Promotional,,
Your are eligible for instant personal loans up to Rs5 Lacs from Kreditbee with flexible repayment options.Submit your KYC now https://bit.ly/3rNF5Hp Linkbel,Promotional,,
"Offer for 9059XXX997 ! Recharge now to enjoy 1GB/day, 100 SMS/day & UL calls for 28 days in Rs209. Get exclusive benefits onThanks App. i.airtel.in/AirRechThanks App. i.airtel.in/AirRech AA-65000122-11-2023",Promotional,,
"Offer for 9059XXX997 ! Recharge now to enjoy 1GB/day, 100 SMS/day & UL calls for 28 days in Rs209. Get exclusive benefits onThanks App. i.airtel.in/AirRechThanks App. i.airtel.in/AirRech AA-65000122-11-2023",Promotional,,
"Offer for 9059XXX997 ! Recharge now to enjoy 1GB/day, 100 SMS/day & UL calls for 28 days in Rs209. Get exclusive benefits onThanks App. i.airtel.in/AirRechThanks App. i.airtel.in/AirRech AA-65000122-11-2023",Promotional,,
"Offer for 9059XXX997 ! Recharge now to enjoy 1GB/day, 100 SMS/day & UL calls for 28 days in Rs209. Get exclusive benefits onThanks App. i.airtel.in/AirRechThanks App. i.airtel.in/AirRech AA-65000122-11-2023",Promotional,,
Hi User AXIS Bank- Get your Pre-qualified AXIS bank Card with a limit of upto Rs.345000/-. Confirm your details Now :l01.in/hi9ort!8qp3541 HexWEBl01.in/hi9ort!8qp3541 HexWEB AX-HXPAIS22-11-2023,Promotional,,
Hi user SBI Bank- Your Rs.255000/- Limit Credit Card is approved. Please Confirm Your details l01.in/guoo5i!8qbmm1e JADEADVRT AX-JADESB17-11-2023,Promotional,,
Hey- HDFC BANK - Your Rs.225000/- Limit Credit Card is approved. Please Confirm Your details: l01.in/gubjpl!8qbmm1e JADEADVRT AX-JADEHD17-11-2023,Promotional,,
"Dear Customer, Congrats! You are eligible for Personal Loan Pre Approved offer of Rs.300,000. Call on 18002106292 Or Misscall on 7065263131. T&C.Bajaj Finance Ltd",Promotional,,
Hi User AXIS Bank- Get your Pre-qualified AXIS bank Card with a limit of upto Rs.345000/-. Confirm your details Now : l01.in/hj47va!8r0ddfn HexWEB,Promotional,,
Good News 915044xxxx Loan amount of Rs 125000 Can Be ready to be disbursed. Confirm your details l01.in/hkod7e!8gmhh7m - Credit Mantri,Promotional,,
"Godrej-Meadows, Baner-Mahalunge Rd, 7.5Acres Central-Park Facing  Fully Furnished2BHK-74L-All-In 15:85-Plan-AVBL. E-Catalogue: https://wa.link/godrej-meadows2BHK-74L-All-In 15:85-Plan-AVBL. E-Catalogue: https://wa.link/godrej-meadows AX-MHLNGE21-11-2023",Promotional,,
"TRANSFER UR EXISTING HOME LOAN TO OUR BANK @8.35% ONWARD AND GET ADDITIONAL LOAN @8.40% ONWARD ZERO FEES TILL 30 T&C
CALL: 9888217401
SNGLON",Promotional,,
[#] 9058 is your OTP for APNATIME job portal. It is valid for 10 minutes. Do not share your OTP with anyone. 9eJcXmKs6I6,Service,,
<#> 162447 is OTP for KreditBee signup. Do not share OTP with anyone VuEEYdUJxhz,Service,,
311app green delhi app sameer app et plant more trees dpcc areas report air poluting activities thruedo not litter dispose waste garbage in open areas,Promotional, ,
